python/sglang/srt/layers/moe/fused_moe_triton/configs/triton_3_6_0/E=384,N=128,device_name=AMD_Instinct_MI355X,dtype=int4_w4a16.json
{
    "1": {
        "BLOCK_SIZE_M": 1,
        "BLOCK_SIZE_N": 4,
        "BLOCK_SIZE_K": 128,
        "GROUP_SIZE_M": 1,
        "num_warps": 1,
        "num_stages": 1,
        "waves_per_eu": 0,
        "matrix_instr_nonkdim": 16,
        "kpack": 1
    },
    "2": {
        "BLOCK_SIZE_M": 16,
        "BLOCK_SIZE_N": 32,
        "BLOCK_SIZE_K": 256,
        "GROUP_SIZE_M": 1,
        "num_warps": 4,
        "num_stages": 2,
        "waves_per_eu": 0,
        "matrix_instr_nonkdim": 16,
        "kpack": 1
    },
    "4": {
        "BLOCK_SIZE_M": 16,
        "BLOCK_SIZE_N": 32,
        "BLOCK_SIZE_K": 256,
        "GROUP_SIZE_M": 1,
        "num_warps": 4,
        "num_stages": 2,
        "waves_per_eu": 0,
        "matrix_instr_nonkdim": 16,
        "kpack": 1
    },
    "8": {
        "BLOCK_SIZE_M": 16,
        "BLOCK_SIZE_N": 32,
        "BLOCK_SIZE_K": 256,
        "GROUP_SIZE_M": 1,
        "num_warps": 4,
        "num_stages": 2,
        "waves_per_eu": 0,
        "matrix_instr_nonkdim": 16,
        "kpack": 1
    },
    "16": {
        "BLOCK_SIZE_M": 32,
        "BLOCK_SIZE_N": 32,
        "BLOCK_SIZE_K": 256,
        "GROUP_SIZE_M": 1,
        "num_warps": 4,
        "num_stages": 2,
        "waves_per_eu": 0,
        "matrix_instr_nonkdim": 16,
        "kpack": 1
    },
    "32": {
        "BLOCK_SIZE_M": 32,
        "BLOCK_SIZE_N": 64,
        "BLOCK_SIZE_K": 128,
        "GROUP_SIZE_M": 1,
        "num_warps": 4,
        "num_stages": 2,
        "waves_per_eu": 0,
        "matrix_instr_nonkdim": 16,
        "kpack": 1
    },
    "64": {
        "BLOCK_SIZE_M": 64,
        "BLOCK_SIZE_N": 64,
        "BLOCK_SIZE_K": 128,
        "GROUP_SIZE_M": 1,
        "num_warps": 8,
        "num_stages": 2,
        "waves_per_eu": 0,
        "matrix_instr_nonkdim": 16,
        "kpack": 1
    },
    "128": {
        "BLOCK_SIZE_M": 64,
        "BLOCK_SIZE_N": 128,
        "BLOCK_SIZE_K": 128,
        "GROUP_SIZE_M": 1,
        "num_warps": 8,
        "num_stages": 2,
        "waves_per_eu": 0,
        "matrix_instr_nonkdim": 16,
        "kpack": 1
    },
    "256": {
        "BLOCK_SIZE_M": 128,
        "BLOCK_SIZE_N": 128,
        "BLOCK_SIZE_K": 128,
        "GROUP_SIZE_M": 1,
        "num_warps": 8,
        "num_stages": 2,
        "waves_per_eu": 0,
        "matrix_instr_nonkdim": 16,
        "kpack": 1
    }
}
